{
  "dataset_id": "D4",
  "collection": "MOD13A3",
  "version": "061",
  "source_type": "mission_product",
  "variable": "NDVI / EVI",
  "units": "dimensionless packed index with documented scale factor 0.0001",
  "spatial_support": "nominal 1 km MODIS sinusoidal tiles",
  "temporal_support": "monthly composite",
  "coverage_start": "2000-02-01",
  "coverage_end": null,
  "quality_policy": {
    "fill_values": ["collection-specific reserved values"],
    "mask_description": "Decode MODLAND quality, usefulness, aerosol, cloud, snow, and land/water fields before aggregation.",
    "qa_fields": ["quality/reliability fields"]
  },
  "retrieval": {
    "provider": "NASA LP DAAC",
    "access_url": "https://cmr.earthdata.nasa.gov/search/collections.json",
    "retrieved_at": "REPLACE_AT_INGEST",
    "granules": 0,
    "checksums": []
  },
  "provenance": {
    "documentation_urls": ["https://doi.org/10.5067/MODIS/MOD13A3.061", "https://ladsweb.modaps.eosdis.nasa.gov/missions-and-measurements/products/MOD13A3"],
    "doi": "10.5067/MODIS/MOD13A3.061",
    "software_version": "REPLACE_WITH_ADAPTER_VERSION",
    "manifest_hash": null
  }
}

